{
  "schema_version": "1.0.0",
  "register_version": "0.1.0",
  "evidence_status": "M",
  "hazards": [
    {
      "id": "HZ-001",
      "title": "Rotor imbalance or loosened rotating mass",
      "subsystems": ["rotating_core", "drive", "containment"],
      "operating_states": ["READY", "RUN", "CONTROLLED_REFUSAL", "COOLDOWN_CLEARING"],
      "initiating_events": ["uneven feed distribution", "retained material", "loosened component", "rotor damage"],
      "consequences": ["bearing or shaft overload", "apparatus movement", "fragment release"],
      "severity": "catastrophic",
      "likelihood_basis": "Credible during commissioning and after wear; apparatus-specific occurrence data do not yet exist.",
      "detection": ["independent speed observation", "vibration magnitude and trend", "drive current or torque plausibility"],
      "controls": [{"id": "CTRL-001", "description": "Bound admitted load and imbalance; contain the maximum credible fragment and feedstock projectile.", "type": "passive", "required": true, "verification": "Calculation and witnessed containment test for the defined envelope."}],
      "response": ["inhibit feed", "execute commissioned brake-or-coast sequence", "retain access locks", "latch fault and require rotor inspection"],
      "verification": [{"id": "TR-001", "kind": "test", "status": "planned", "reference": "Deliberate bounded-imbalance commissioning test"}],
      "evidence_status": "M",
      "residual_risk": "Unbounded until rotor, enclosure, mounting, sensors, and stop behavior are specified.",
      "open_questions": ["What imbalance metric and persistence limit protect the selected rotor and enclosure?"]
    },
    {
      "id": "HZ-002",
      "title": "Overspeed or speed-sensor disagreement",
      "subsystems": ["rotating_core", "drive", "safety_control"],
      "operating_states": ["READY", "RUN", "CONTROLLED_REFUSAL", "FAULT_LATCHED"],
      "initiating_events": ["primary control failure", "sensor failure", "incorrect configuration", "drive fault"],
      "consequences": ["stored energy beyond containment basis", "rotor failure", "unsafe access timing"],
      "severity": "catastrophic",
      "likelihood_basis": "A credible single-control or sensing fault; no validated drive architecture exists.",
      "detection": ["independent overspeed channel", "cross-channel plausibility check"],
      "controls": [{"id": "CTRL-002", "description": "Use an independent speed-limiting path and configuration-bound maximum.", "type": "electronic", "required": true, "verification": "Inject primary-control and sensor faults without exceeding the verified limit."}],
      "response": ["isolate feed", "command verified safe stop", "retain guard lock", "latch for trained inspection"],
      "verification": [{"id": "TR-002", "kind": "test", "status": "planned", "reference": "Overspeed and disagreement fault-injection protocol"}],
      "evidence_status": "M",
      "residual_risk": "Independent limit, response time, and braking consequence remain apparatus-specific.",
      "open_questions": ["What maximum credible speed remains after every single drive and control fault?"]
    },
    {
      "id": "HZ-003",
      "title": "Rotor, shaft, bearing, fastener, or chamber failure",
      "subsystems": ["rotating_core", "drive", "containment"],
      "operating_states": ["RUN", "CONTROLLED_REFUSAL", "COOLDOWN_CLEARING", "SERVICE_LOCKOUT"],
      "initiating_events": ["fatigue", "wear", "corrosion", "assembly error", "impact", "overtemperature"],
      "consequences": ["fragment release", "fire or hot debris", "loss of containment"],
      "severity": "catastrophic",
      "likelihood_basis": "Credible over service life; materials, loads, duty cycle, and retirement limits are unresolved.",
      "detection": ["vibration and temperature trends", "pre-run inspection", "cycle and operating-hour history"],
      "controls": [{"id": "CTRL-003", "description": "Configuration-control critical parts and retire them by verified life or condition limit.", "type": "mechanical", "required": true, "verification": "Design analysis, inspection validation, and retirement-record audit."}],
      "response": ["protectively stop", "maintain containment", "prohibit reset", "replace or inspect affected protected modules"],
      "verification": [{"id": "TR-003", "kind": "calculation", "status": "open", "reference": "Structural, fatigue, retention, and credible-fragment analysis"}],
      "evidence_status": "M",
      "residual_risk": "Cannot be ranked until configuration, credible failure energy, and service life are defined.",
      "open_questions": ["Which parts are life-limited and what evidence sets each retirement point?"]
    },
    {
      "id": "HZ-004",
      "title": "Jam, bridging, blocked outlet, or feed surge",
      "subsystems": ["intake", "feed", "rotating_core", "routing"],
      "operating_states": ["QUARANTINE", "READY", "RUN", "CONTROLLED_REFUSAL"],
      "initiating_events": ["oversized object", "cohesive or wet feed", "gate failure", "feed-control fault"],
      "consequences": ["overload", "unexpected stored energy", "pressure rise", "operator reach-in"],
      "severity": "critical",
      "likelihood_basis": "Expected misuse and process upset for heterogeneous material streams.",
      "detection": ["feed-motion observation", "torque or current trend", "pressure and flow disagreement", "mass-flow plausibility"],
      "controls": [{"id": "CTRL-004", "description": "Isolate the feed and provide a no-reach clearing method with residual-energy verification.", "type": "mechanical", "required": true, "verification": "Jam tests covering the admitted size, shape, moisture, and feed-rate envelope."}],
      "response": ["stop feed before opening any path", "reach a verified access state", "record and quarantine recovered material"],
      "verification": [{"id": "TR-004", "kind": "test", "status": "planned", "reference": "Bounded jam and blockage recovery test matrix"}],
      "evidence_status": "M",
      "residual_risk": "Detection thresholds and the clearing mechanism are not yet selected.",
      "open_questions": ["Can every credible jam be cleared without entering a hazardous zone?"]
    },
    {
      "id": "HZ-005",
      "title": "Dust, fines, aerosols, or electrostatic charging",
      "subsystems": ["intake", "rotating_core", "exhaust", "filters", "cleaning"],
      "operating_states": ["RUN", "CONTROLLED_REFUSAL", "COOLDOWN_CLEARING", "USER_ACCESS"],
      "initiating_events": ["friable material", "abrasion", "high airflow", "dry insulating feed", "filter service"],
      "consequences": ["inhalation or contact exposure", "combustible atmosphere", "ignition", "cross-contamination"],
      "severity": "catastrophic",
      "likelihood_basis": "Fine solids are a foreseeable product of sorting and wear; combustibility is material-specific.",
      "detection": ["filter differential pressure", "airflow and pressure trend", "material-specific dust assessment", "containment inspection"],
      "controls": [{"id": "CTRL-005", "description": "Admit dust-forming material only under a documented dust, ignition, grounding, capture, and housekeeping envelope.", "type": "inherent", "required": true, "verification": "Material review and controlled capture tests; specialist review where combustible dust is credible."}],
      "response": ["inhibit new feed", "apply event-specific extraction or isolation", "retain access restrictions", "use contained cleanup"],
      "verification": [{"id": "TR-005", "kind": "standard", "status": "open", "reference": "https://www.osha.gov/combustible-dust"}],
      "evidence_status": "M",
      "residual_risk": "No material may inherit a generic noncombustible or nonhazardous classification.",
      "open_questions": ["Which candidate materials and wear products require specialist dust testing?"]
    },
    {
      "id": "HZ-006",
      "title": "Fire, smoke, abnormal heat, or hot accessible surface",
      "subsystems": ["drive", "electrical", "process", "filters", "enclosure"],
      "operating_states": ["READY", "RUN", "CONTROLLED_REFUSAL", "COOLDOWN_CLEARING", "FAULT_LATCHED"],
      "initiating_events": ["bearing failure", "motor or wiring fault", "friction", "ignition of material or filter"],
      "consequences": ["burn", "fire spread", "smoke exposure", "pressure or containment escalation"],
      "severity": "catastrophic",
      "likelihood_basis": "Credible electrical, mechanical, and material ignition sources exist in the concept.",
      "detection": ["component and air-stream temperature", "smoke or fire detection where justified", "electrical protective-device state"],
      "controls": [{"id": "CTRL-006", "description": "Separate ignition sources from admitted material hazards and define compatible detection, isolation, ventilation, and suppression.", "type": "passive", "required": true, "verification": "Thermal analysis and independently reviewed fire-response tests appropriate to the apparatus."}],
      "response": ["stop feed and hazardous motion", "isolate energy as the event permits", "continue or isolate ventilation according to tested fire scenario", "alarm and latch"],
      "verification": [{"id": "TR-006", "kind": "open_question", "status": "open", "reference": "Select jurisdiction, fire scenarios, detection, and compatible suppression before fire testing"}],
      "evidence_status": "M",
      "residual_risk": "Ventilation and suppression choices may worsen some events and require scenario-specific evidence.",
      "open_questions": ["Which fire classes can occur in each isolated subsystem?"]
    },
    {
      "id": "HZ-007",
      "title": "Leak, failed seal, detached collector, or ruptured duct",
      "subsystems": ["containment", "routing", "exhaust", "collectors"],
      "operating_states": ["READY", "RUN", "CONTROLLED_REFUSAL", "USER_ACCESS"],